{
  "capabilities": [
    {
      "absenceBehavior": "disable",
      "callable": false,
      "category": "content",
      "conflicts": [],
      "dependencies": [
        "content.staticLooks"
      ],
      "deprecated": false,
      "description": "Studio can simulate a Static Look draft asynchronously and, after explicit operator arming, use the bounded physical-preview authority while Live is stopped.",
      "experimental": false,
      "id": "content.staticLookPreview",
      "introducedGeneration": 2,
      "label": "Static Look preview",
      "origin": "application",
      "qualificationStatus": "softwareVerified",
      "relevantCommands": [
        "staticLook.preview.start",
        "staticLook.preview.stop"
      ],
      "relevantComponents": [
        "ember.staticLookPreview"
      ],
      "relevantStates": [
        "staticLook.preview.error",
        "staticLook.preview.frameDigest",
        "staticLook.preview.mode",
        "staticLook.preview.outputCap",
        "staticLook.preview.remainingMs",
        "staticLook.preview.selectedFixtureCount",
        "staticLook.preview.state",
        "staticLook.preview.updateCount"
      ],
      "status": "implemented",
      "version": "1.0.0"
    },
    {
      "absenceBehavior": "reject",
      "callable": false,
      "category": "content",
      "conflicts": [],
      "dependencies": [],
      "deprecated": false,
      "description": "The active compiled package supports stable-ID Static Look activation and authoritative active-state feedback.",
      "experimental": false,
      "id": "content.staticLooks",
      "introducedGeneration": 2,
      "label": "Static Looks",
      "origin": "project",
      "qualificationStatus": "softwareVerified",
      "relevantCommands": [
        "staticLook.activate",
        "staticLook.clear",
        "staticLook.hold",
        "staticLook.toggle"
      ],
      "relevantComponents": [
        "ember.staticLookMatrix"
      ],
      "relevantStates": [
        "staticLook.active.id"
      ],
      "status": "implemented",
      "version": "1.0.0"
    }
  ],
  "commands": [
    {
      "availability": "runner.state == 'running'",
      "category": "autoloop",
      "deprecated": false,
      "description": "Enables all 64 Autoloop banks in the current filter mask.",
      "feedback": [
        "autoloop.bankFilter.mask"
      ],
      "id": "autoloop.bankFilter.enableAll",
      "interaction": "trigger",
      "introducedGeneration": 1,
      "keyboardBindable": true,
      "label": "Enable all Autoloop banks",
      "midiBindable": true,
      "nativeName": "AutoloopBankFilterEnableAll",
      "nativeOrdinal": 20,
      "parameters": {},
      "persistenceScope": "liveTransient",
      "realtimeClass": "runnerCommand",
      "safetyClass": "normal",
      "safetyGate": null,
      "scopes": [
        "live",
        "keyboard",
        "midi",
        "controller",
        "external"
      ],
      "status": "implemented",
      "undoable": false
    },
    {
      "availability": "runner.state == 'running'",
      "category": "autoloop",
      "deprecated": false,
      "description": "Selects exactly one enabled Autoloop bank.",
      "feedback": [
        "autoloop.bankFilter.mask"
      ],
      "id": "autoloop.bankFilter.selectExclusive",
      "interaction": "selection",
      "introducedGeneration": 1,
      "keyboardBindable": true,
      "label": "Select exclusive Autoloop bank",
      "midiBindable": true,
      "nativeName": "AutoloopBankFilterSelectExclusive",
      "nativeOrdinal": 21,
      "parameters": {
        "bank": {
          "maximum": 63,
          "minimum": 0,
          "required": true,
          "type": "integer"
        }
      },
      "persistenceScope": "liveTransient",
      "realtimeClass": "runnerCommand",
      "safetyClass": "normal",
      "safetyGate": null,
      "scopes": [
        "live",
        "keyboard",
        "midi",
        "controller",
        "external"
      ],
      "status": "implemented",
      "undoable": false
    },
    {
      "availability": "runner.state == 'running'",
      "category": "autoloop",
      "deprecated": false,
      "description": "Sets one bank bit in the active Autoloop filter mask.",
      "feedback": [
        "autoloop.bankFilter.mask"
      ],
      "id": "autoloop.bankFilter.setEnabled",
      "interaction": "absolute",
      "introducedGeneration": 1,
      "keyboardBindable": true,
      "label": "Set Autoloop bank enabled",
      "midiBindable": true,
      "nativeName": "AutoloopBankFilterSetEnabled",
      "nativeOrdinal": 22,
      "parameters": {
        "bank": {
          "maximum": 63,
          "minimum": 0,
          "required": true,
          "type": "integer"
        },
        "enabled": {
          "required": true,
          "type": "boolean"
        }
      },
      "persistenceScope": "liveTransient",
      "realtimeClass": "runnerCommand",
      "safetyClass": "normal",
      "safetyGate": null,
      "scopes": [
        "live",
        "keyboard",
        "midi",
        "controller",
        "external"
      ],
      "status": "implemented",
      "undoable": false
    },
    {
      "availability": "runner.state == 'running'",
      "category": "autoloop",
      "deprecated": false,
      "description": "Clears the active manual Autoloop.",
      "feedback": [
        "autoloop.active.id"
      ],
      "id": "autoloop.clear",
      "interaction": "trigger",
      "introducedGeneration": 1,
      "keyboardBindable": true,
      "label": "Clear Autoloop",
      "midiBindable": true,
      "nativeName": "AutoloopClear",
      "nativeOrdinal": 17,
      "parameters": {},
      "persistenceScope": "liveTransient",
      "realtimeClass": "runnerCommand",
      "safetyClass": "normal",
      "safetyGate": null,
      "scopes": [
        "live",
        "keyboard",
        "midi",
        "controller",
        "external"
      ],
      "status": "implemented",
      "undoable": false
    },
    {
      "availability": "runner.state == 'running' && autoloop.targetExists",
      "category": "autoloop",
      "deprecated": false,
      "description": "Launches one compiled Autoloop by stable ID or bank and slot.",
      "feedback": [
        "autoloop.active.id",
        "autoloop.active.bank",
        "autoloop.active.slot",
        "autoloop.active.progress"
      ],
      "id": "autoloop.launch",
      "interaction": "trigger",
      "introducedGeneration": 1,
      "keyboardBindable": true,
      "label": "Launch Autoloop",
      "midiBindable": true,
      "nativeName": "AutoloopLaunch",
      "nativeOrdinal": 16,
      "parameters": {
        "autoloopId": {
          "required": false,
          "targetKind": "autoloop",
          "type": "id"
        },
        "bank": {
          "maximum": 63,
          "minimum": 0,
          "required": false,
          "type": "integer"
        },
        "slot": {
          "maximum": 31,
          "minimum": 0,
          "required": false,
          "type": "integer"
        }
      },
      "persistenceScope": "liveTransient",
      "realtimeClass": "runnerCommand",
      "safetyClass": "normal",
      "safetyGate": null,
      "scopes": [
        "live",
        "keyboard",
        "midi",
        "controller",
        "external"
      ],
      "status": "implemented",
      "undoable": false
    },
    {
      "availability": "runner.state == 'running'",
      "category": "autoloop",
      "deprecated": false,
      "description": "Launches the next eligible compiled Autoloop using current navigation semantics.",
      "feedback": [
        "autoloop.active.id"
      ],
      "id": "autoloop.next",
      "interaction": "trigger",
      "introducedGeneration": 1,
      "keyboardBindable": true,
      "label": "Next Autoloop",
      "midiBindable": true,
      "nativeName": "AutoloopNext",
      "nativeOrdinal": 18,
      "parameters": {},
      "persistenceScope": "liveTransient",
      "realtimeClass": "runnerCommand",
      "safetyClass": "normal",
      "safetyGate": null,
      "scopes": [
        "live",
        "keyboard",
        "midi",
        "controller",
        "external"
      ],
      "status": "implemented",
      "undoable": false
    },
    {
      "availability": "runner.state == 'running'",
      "category": "autoloop",
      "deprecated": false,
      "description": "Launches the previous eligible compiled Autoloop using current navigation semantics.",
      "feedback": [
        "autoloop.active.id"
      ],
      "id": "autoloop.previous",
      "interaction": "trigger",
      "introducedGeneration": 1,
      "keyboardBindable": true,
      "label": "Previous Autoloop",
      "midiBindable": true,
      "nativeName": "AutoloopPrevious",
      "nativeOrdinal": 19,
      "parameters": {},
      "persistenceScope": "liveTransient",
      "realtimeClass": "runnerCommand",
      "safetyClass": "normal",
      "safetyGate": null,
      "scopes": [
        "live",
        "keyboard",
        "midi",
        "controller",
        "external"
      ],
      "status": "implemented",
      "undoable": false
    },
    {
      "availability": "runner.state == 'running' && fixture.supports(property)",
      "category": "override",
      "deprecated": false,
      "description": "Releases one property override from a stable fixture.",
      "feedback": [
        "override.activePropertyCount"
      ],
      "id": "fixture.override.property.release",
      "interaction": "trigger",
      "introducedGeneration": 1,
      "keyboardBindable": true,
      "label": "Release fixture property override",
      "midiBindable": true,
      "nativeName": "FixtureOverridePropertyRelease",
      "nativeOrdinal": 26,
      "parameters": {
        "fixtureId": {
          "required": true,
          "targetKind": "fixture",
          "type": "id"
        },
        "property": {
          "required": true,
          "schemaRef": "value.fixtureProperty",